experience_id,user_id,engagement_id,type,title,description,start_date,end_date
1,1,1,work,Software Engineer,"Situation: Google was scaling its cloud services.
Task: Led a team to optimize database performance.
Action: Implemented indexing strategies and query optimizations.
Result: Achieved a 40% reduction in query response time.",2010-06-01,2020-08-01
2,1,1,work,Software Engineer,"Situation: Google needed a secure authentication system.
Task: Designed a new OAuth-based system.
Action: Developed a multi-factor authentication protocol.
Result: Increased security compliance and reduced fraud by 30%.",2010-06-01,2020-08-01
3,1,2,work,Kitchen Hand,"Situation: High customer volume at McDonald's.
Task: Ensure quick and efficient food preparation.
Action: Streamlined ingredient preparation process.
Result: Reduced average food preparation time by 15%.",2009-05-01,2010-06-01
4,1,2,work,Kitchen Hand,"Situation: Frequent errors in order fulfillment.
Task: Improve order accuracy.
Action: Introduced a double-checking system.
Result: Decreased incorrect orders by 20%.",2009-05-01,2010-06-01
5,1,3,side-hustle,Software Engineer,"Situation: Developed custom web applications for clients.
Task: Improve business efficiency through automation.
Action: Created automated workflows using Python and JavaScript.
Result: Saved clients an average of 10 hours per week on manual tasks.",2013-06-01,2017-06-01
6,1,3,side-hustle,Software Engineer,"Situation: Clients needed better data insights.
Task: Build analytics dashboards.
Action: Implemented real-time data visualization.
Result: Increased client decision-making speed by 25%.",2013-06-01,2017-06-01
7,1,4,education,Computer Science BSc,"Situation: Studying foundational computer science.
Task: Complete coursework on algorithms and systems.
Action: Developed a real-time operating system simulation.
Result: Earned top marks and presented at a student conference.",2006-09-01,2009-05-01
8,2,5,work,Project Manager,"Situation: Capgemini needed to streamline project delivery.
Task: Improve cross-functional collaboration.
Action: Introduced Agile frameworks.
Result: Increased project delivery efficiency by 35%.",2018-12-01,2022-06-01
9,2,6,work,Business Analyst,"Situation: Deloitte clients needed better financial forecasting.
Task: Develop predictive models.
Action: Leveraged machine learning techniques.
Result: Improved forecasting accuracy by 20%.",2014-06-01,2018-12-01
10,2,7,education,Business Management BA,"Situation: Learning core business principles.
Task: Complete coursework in finance, strategy, and marketing.
Action: Conducted a market analysis project.
Result: Recognized with an award for best research paper.",2011-09-01,2014-06-01
11,3,8,work,Property Lettings Agent,"Situation: Lettings UK needed better client retention.
Task: Improve customer engagement strategies.
Action: Implemented a CRM system.
Result: Increased client satisfaction scores by 30%.",2021-05-01,
12,3,9,side-hustle,Online Retailer,"Situation: Self-employed in online retail.
Task: Scale e-commerce operations.
Action: Optimized supply chain and implemented targeted advertising.
Result: Increased monthly sales revenue by 50%.",2018-07-01,2021-04-01
13,3,10,education,Real Estate Certification,"Situation: Studying real estate investment principles.
Task: Complete coursework and pass certification exams.
Action: Conducted a property valuation case study.
Result: Achieved top scores and applied knowledge in career.",2019-01-01,2019-06-01